{
  "$schema": "../Schemas/control_scheme_v1.json",
  "schemaVersion": 1,
  "id": "racing_xbox360_layout_b",
  "name": "Xbox 360 Racing Controls - Layout B",
  "keyboard": {
    "steering": {
      "negative": [],
      "positive": []
    },
    "actions": {
      "accelerate": {
        "keys": []
      },
      "brake": {
        "keys": []
      },
      "handbrake": {
        "keys": []
      },
      "reverse": {
        "keys": []
      },
      "lookBehind": {
        "keys": []
      },
      "toggleView": {
        "keys": []
      },
      "shiftDown": {
        "keys": []
      },
      "shiftUp": {
        "keys": []
      },
      "pause": {
        "keys": []
      },
      "exit": {
        "keys": []
      },
      "toggleDebug": {
        "keys": []
      },
      "toggleTransmissionMode": {
        "keys": []
      }
    }
  },
  "gamePad": {
    "playerIndex": "One",
    "triggerPressedThreshold": 0.55,
    "steering": {
      "axis": "LeftThumbstickX",
      "invertAxis": true,
      "deadZone": 0.16,
      "negativeButtons": [
        "DPadRight"
      ],
      "positiveButtons": [
        "DPadLeft"
      ]
    },
    "actions": {
      "accelerate": {
        "triggers": [
          "RightTrigger"
        ]
      },
      "brake": {
        "triggers": [
          "LeftTrigger"
        ]
      },
      "handbrake": {
        "buttons": [
          "B"
        ]
      },
      "reverse": {
        "buttons": []
      },
      "lookBehind": {
        "buttons": [
          "LeftShoulder"
        ]
      },
      "toggleView": {
        "buttons": [
          "Y"
        ]
      },
      "shiftDown": {
        "negativeAxes": [
          "RightThumbstickY"
        ]
      },
      "shiftUp": {
        "positiveAxes": [
          "RightThumbstickY"
        ]
      },
      "pause": {
        "buttons": [
          "Start"
        ]
      },
      "exit": {},
      "toggleDebug": {},
      "toggleTransmissionMode": {}
    },
    "unmappedWhileRacing": [
      "Back"
    ]
  },
  "menu": {
    "confirm": {
      "keys": [],
      "buttons": [
        "A",
        "B",
        "Start"
      ]
    },
    "cancel": {
      "keys": [],
      "buttons": [
        "X",
        "Back"
      ]
    },
    "navigation": {
      "horizontalAxis": "LeftThumbstickX",
      "verticalAxis": "LeftThumbstickY",
      "deadZone": 0.45,
      "leftKeys": [],
      "rightKeys": [],
      "upKeys": [],
      "downKeys": [],
      "leftButtons": [
        "DPadLeft"
      ],
      "rightButtons": [
        "DPadRight"
      ],
      "upButtons": [
        "DPadUp"
      ],
      "downButtons": [
        "DPadDown"
      ]
    }
  }
}
